name,director,description,ranking
"Amores Perros","Alejandro González Iñárritu","El debut de Inárritu, ahora consentido de Hollywood, relata cuatro historias que se entrelazan en la vorágine de la Ciudad de México, presentando un mosaico de realidades que convergen en la capital mexicana. A partir de un accidente de tráfico, las cuatro historias se entrelazan y desencadenan el clímax de la ópera prima del mexicano.",0
"Nueve Reinas","Fabián Bielinsky","Dos estafadores que solían trabajar ganando algunos pesos argentinos, se conocen de manera fortuita, y pronto se ven envueltos en un gran negocio que les promete una suma que alcanza los centenares de miles. En 24 horas, la vida de los estafadores cambiará de manera drástica, pues la urgencia del nuevo negocio les evitará entrar en dudas y los llevará a hacer lo necesario para alcanzar la gran oportunidad que han buscado desde hace años.",0
"Y tu Mamá También","Alfonso Cuarón","Originarios del D.F. dos jóvenes están de vacaciones, y en una boda familiar conocerán a Luisa Cortés, esposa del primo de uno de ellos, y quien determinará la relación entre los dos amigos. El erotismo y la sensualidad de Luisa revuelven las emociones de los jóvenes, quienes encontrarán en sus vacaciones una forma de saciar su deseo. Esta película fue la encargada de catapultar a Cuarón hacia la fama internacional.",0
"Ciudade de Deus","Fernando Meirelles","La favela homónima ubicada en Río de Janeiro se transforma con la llegada del tráfico de drogas y la violencia al interior de las casas marginadas de la capital brasileña. La película, inspirada en un aclamado libro brasileño, retrata el espiral de violencia en el que un grupo de jóvenes caen al vivir en un entorno marcado por la muerte y la droga.",0
"Whisky","Juan Pablo Rebella","Esta producción en conjunto con Argentina, Alemania y España, cuenta la historia de dos hermanos judíos fabricantes de medias. Uno de ellos es un exitoso industrial que radica en Brasil, mientras el otro lleva una aburrida vida en Montevideo. El hermano proveniente de Brasil, visitará a su hermano en la capital uruguaya, a quien convencerá de pedirle a su empleada para que asuma el rol de su esposa. Los tres viajarán a un balneario en el que los hermanos estrecharán lazos y les permitirá salir de la rutina.",0
"Machuca","Andrés Wood","La producción nos remite a Santiago de Chile en 1973, y aborda un experimento real hecho en el gobierno de Allende. Un grupo de niños de escasos recursos es llevado a una escuela de clase media y alta para estudiar en dicha institución, promoviendo un ambiente de aprendizaje, respeto e inclusión social. A pesar de las diferencias sociales, Gonzalo y Machuca se hacen buenos amigos, y a través de los juegos y las visitas a las casas de cada uno, tendrán la oportunidad de entender las diferencias que se viven en el país, y las cuales se acentuarán con el golpe de estado de Pinochet.",0
"Casa de Areia","Andrucha Waddington","Waddington nos narra la vida de tres generaciones de mujeres: madre, hija y nieta, quienes se mudan a una granja en medio del desierto. Sin embargo, la oportunidad de prosperar se ve frustrada cuando un grupo de esclavos que han huido de sus señoríos los empieza a hostigar, un hecho que se une a la locura del esposo de la hija, Vasco de Sá, quien convertirá al pequeño oasis en un infierno.",0
"Los Viajes del Viento","Ciro Guerra","Ambientada en 1968, Ignacio Carrillo es un juglar que ha decidido realizar un último viaje después de años de aventuras, travesías y nuevos horizontes. Ahora, atravesará la región norte de Colombia para devolver el instrumento a su antiguo maestro y despedirse de la música. Esta road movie latinoamericana hace un recorrido por la enorme diversidad de la cultura caribeña, en el que las aventuras no cesarán en compañía de un inesperado joven.",0
"El Secreto de Sus Ojos","Juan José Campanella","Benjamín Espósito es un oficial retirado del juzgado de Buenos Aires, quien vive obsesionado por un brutal asesinato que ocurrió 25 años y del cual no hubo resolución, pero que le servirá como inspiración para escribir una novela. En dos tiempos cronológicos distintos, la trama nos cuenta lo sucedido en 1974, y en el presente, en el que Espósito luchará contra el fantasma de una mujer a quien amó, mientras la nueva perspectiva sobre el asesinato lo conduce de nuevo sobre las pistas.",0
"No","Pablo Larraín","Protagonizada por Gael García Bernal, la trama de esta película está basada en una obra de teatro llamada El plebiscito de Antonio Skármeta y narra la campaña publicitaria realizada en Chile para evitar la permanencia de Pinochet en 1988. El protagonista regresará de su exilio en México para encabezar la campaña que podría significar la dictadura militar en Chile y abrir camino hacia la democracia.",0
"Pelo Malo","Mariana Rondón","En el complicado salto de la infancia a la adolescencia, Junior es un niño afeminado que quiere alisarse el pelo para la fotografía de su escuela, pero se enfrenta a la negativa de su madre. A partir de este hecho, Junio se enfrentará a su madre y a su machista abuela, quienes lo miran con prejuicios por no entender la diversidad del ser humano. En una Caracas a punto de explotar, la película muestra retazos de una sociedad que vive a partir de la hostilidad y la violencia.",0
"La Jaula de Oro","Diego Quemada-Díez","La producción de Quemada-Díez cuenta la historia de dos adolescentes que abandonan su aldea, a quienes se suma un chico indígena, para perseguir el sueño americano. Los tres vivirán en carne propia la realidad de millones de almas que penan por Centroamérica y México, lleno de peligros, accidentes y desafíos. Sin embargo, en el umbral del peligro, la amistad y la solidaridad aflorará.",0
"La Distancia Más Larga","Claudia Pinto","Martina, de 60 años de edad, viaja desde España a Venezuela para despedirse de la vida desde el lugar en el que algún día fue feliz: la Gran Sabana. Con miras a escalar el monte Roraima y dejarse morir a mitad del camino, la visita inesperada de su nieto le permitirá cumplir su última voluntad. Sin embargo, el destino le jugará una poderosa coincidencia cuando la vincule con su joven nieto y que le demostrará que el final de su vida no está marcado en el calendario.",0
"Conducta","Ernesto Daranas","El país caribeño participa en este listado con esta producción que muestra la historia de la maestra Carmela y Chala, un niño de once años sumergido en la marginación y la violencia. Con una madre adicta a las drogas y el alcohol, el futuro de Chala está comprometido a un círculo vicioso que depende de las peleas de perros. Sin embargo, una tenue esperanza se abre gracias a la relación de Chala con su maestra, quien no escatimará atenciones y amor para llevarlo por el buen camino.",0
"Relatos Salvajes","Damián Szifrón","Una de las obras más aclamadas de los últimos años por su capacidad de retratar el “comportamiento humano bajo situaciones extremas pero en contextos cotidianos y fáciles de identificar”. Con situaciones de venganza, muerte, resentimiento, celos y locura, los protagonistas de esta película sacan a relucir su instinto animal y asombran a la audiencia por la capacidad del ser humano por superarse a sí mismo.",0
